,title,link,image,author,discount,publisher,pubdate,isbn,description
55,미국통일상법전 (Uniform Commercial Code(UCC)),https://search.shopping.naver.com/book/catalog/32480420739,https://shopping-phinf.pstatic.net/main_3248042/32480420739.20221229073835.jpg,미국변호사협회,29700,법문사,20061108,9788918017792,"통일상법전은 제1편 총 칙, 제2편 매매, 제2A편 리스, 제3편 유통증권, 제4편 은행예금 및 추심, 제4A편 자금이체, 제5편 신용장, 제6편 일괄매매, 제7편 창고증권, 제8편 투자증권, 제9편 담보부거래, 제10편 시행일 및 폐지 법규, 제11편 시행일 및 경과규정 총 13편으로 구성되어 있다.

우리나라는 영미법계에 속하는 국가의 법원리와 법제도에 대한 연구가 활발하게 진행되어 왔으며, 그 연구성과는 현행의 법제도에 많은 영향을 끼쳤다. 이 중 가장 대표적인 분야가 상거래 분야이며, 대표적인 법이 미국 통일상법전이다. 이러한 통일상법전에 대한 연구의 필요성은 미국을 비롯한 영미법계 국가와의 교류의 확대와 더불어 증대되고 있으며, 현재 각 분야별로 이에 대한 연구가 진행되고 있다."
56,월·E : 중영문 양장본 Hardcover,https://search.shopping.naver.com/book/catalog/32480421069,https://shopping-phinf.pstatic.net/main_3248042/32480421069.20220520112742.jpg,미국디즈니공사,0,호북소년아동출판사,20090801,9787535348548,☞이 책은 중국어로 쓰여져 있습니다.
57,미국을 로비하라,https://search.shopping.naver.com/book/catalog/32482361792,https://shopping-phinf.pstatic.net/main_3248236/32482361792.20221229074242.jpg,송의달,4500,삼성경제연구소,20070611,9788976333476,"초강대국을 지향하는 미국에 관한 이해! 한국의 대미 로비의 올바른 방향!

우리는 미국과 아주 복잡한 관계로 얽혀있다. 현재 미국이 전 세계 평화를 관장하는 듯한 분위기를 풍기고 있으며, 북한 문제와 결부되어 대한민국도 그 아래에 두려한다. 그렇다고 무조건 미국에 반기를 들고 떨쳐내려 하면 안 된다. 적극적인 로비를 펼쳐 그들이 우리의 요구를 들어주도록 마음껏 이용하는 지혜가 필요한 때이다.

『미국을 로비하라』는 21세기 한국의 대외 전략의 핵심 화두인 '미국과의 원만한 관계'를 내세운다. 우리에게 필요한 '자주'와 '동맹'을 동시에 달성할 수 있는 전략적 카드로 미국과의 능동적인 관계 형성의 필요성을 역설하며, 그 방안으로 '대미 로비'를 활성화해야 한다는 주장을 펼친다.

본문은 먼저 왜 미국에 로비를 해야 하는지를 설명하면서 시작한다. 그런 다음 이스라엘, 일본, 중국과 대만 등 로비선진국들이 각각 미국에 어떻게 로비를 했는지, 로비를 펼침으로써 얻은 이익이 무엇이 있었는지를 자세히 살펴본다. 이를 통해 대한민국의 바람직한 대미 로비 방향을 모색해본다."
58,디즈니경전전영고사: 소웅유니(곰돌이푸)(중영문) 양장본 Hardcover,https://search.shopping.naver.com/book/catalog/32482689376,https://shopping-phinf.pstatic.net/main_3248268/32482689376.20220520130522.jpg,미국디즈니공사,0,호북소년아동출판사,20090801,9787535347299,☞이 책은 중국어로 쓰여져 있습니다.
59,몬스터 주식회사 (중영문) 양장,https://search.shopping.naver.com/book/catalog/32483323249,https://shopping-phinf.pstatic.net/main_3248332/32483323249.20220520133915.jpg,미국디즈니공사,0,호북소년아동출판사,20090801,9787535347220,☞ 이 책은 중국어로 쓰여져 있습니다.
60,완구총동원(토이스토리)(중영문) 양장,https://search.shopping.naver.com/book/catalog/32483629040,https://shopping-phinf.pstatic.net/main_3248362/32483629040.20220520134320.jpg,미국디즈니공사,0,호북소년아동출판사,20090801,9787535348562,☞이 책은 중국어로 쓰여져 있습니다.
61,디즈니 CD Storybook : 카 Car,https://search.shopping.naver.com/book/catalog/32485471860,https://shopping-phinf.pstatic.net/main_3248547/32485471860.20221229072342.jpg,미국디즈니공사,15750,호북소아출판사,20100714,9787535347237,디즈니 CD Storybook(중문: 양장본 / 영문:소책자)은 성우가 생동감있에 동화책을 읽어주는 Storybook 입니다. 성우의 언어는 중영다어로 중국어 영어 각각의 원어민이 녹음을 하여 발음이 좋으며 선물용으로도 좋습니다.
62,미국 법률 이야기,https://search.shopping.naver.com/book/catalog/32490343166,https://shopping-phinf.pstatic.net/main_3249034/32490343166.20221230071835.jpg,Howard Lee,18000,석학당,20130827,9788993158700,"한국의 법률은 성문법인데 비해 미국의 법률은 판례법이다. 따라서 미국에 살고 있는 우리 교민들은 미국법의 생소함 때문에 법률에 대한 상식을 접할 기회가 많지 않다. 이에 연합신문의 YTV와 함께 TV 방송을 통해 라루에 30분씩 강의를 진행했고, 이를 받아 미국의 6개 도시에서 방송은 진행하였다. 이 교재는 미국에 살고 있는 교민들을 위해 만든 것으로, 방송을 들으며 쉽게 이해할 수 있도록 구성되었다. 함께 수록한 DVD를 활용하면 더욱 학습에 도움이 될 것이다."
63,미국 불법행위법 (원칙 및 판례),https://search.shopping.naver.com/book/catalog/32490683646,https://shopping-phinf.pstatic.net/main_3249068/32490683646.20220527023838.jpg,잔 칼슨,0,진원사,20130131,9788963462653,"▶ 이 책은 영어로 구성되어 있습니다.

중앙대학교 법과대학 불법행위법률 & 집단소송절차법 겸임교수 잔 칼슨의 『미국 불법행위법』. 한국의 법학도와법조인을 대상으로 미국의 불법행위법에 쉽고 간단하게 접근하도록 구성한 것이다. 불법행위의 요소를 한국어 번역에다가, 주된 요악을 통해 보충설명했다."
64,디즈니경전전영고사: 백설공주(중영문) 양장본 Hardcover,https://search.shopping.naver.com/book/catalog/32491317849,https://shopping-phinf.pstatic.net/main_3249131/32491317849.20220520200841.jpg,미국디즈니공사,0,호북소년아동출판사,20090801,9787535345790,☞이 책은 중국어로 쓰여져 있습니다.
65,"미국, 알고 배우자!",https://search.shopping.naver.com/book/catalog/32491849324,https://shopping-phinf.pstatic.net/main_3249184/32491849324.20221230073051.jpg,최주천,9000,북랩,20131122,9791155850756,"미국 유학 1세대로 미국 연방정부 공무원과 미국 대학 교수로 일한 저자가 미국 사회의 빛과 그림자를 진단했다. 저자는 이 책을 통해 반세기를 훌쩍 넘는 미국생활을 통해 유학생, 여행자들에게 미국의 현주소를 가감 없이 보여주고 어느 나라나 배울 것은 있지만 분별없이 본받는 것은 망국의 지름길임을 강조하고 있다. 또, 미국과 한국 또 그 밖의 여러 나라들의 현실을 꼬집어 이야기하면서 본받아야 할 것과 우리가 전해야 할 것 그리고 융합해야 할 것들을 제시한다."
66,미국 음악가 사전,https://search.shopping.naver.com/book/catalog/32492076118,https://shopping-phinf.pstatic.net/main_3249207/32492076118.20220527022120.jpg,박문정,0,이앤비플러스,20120525,9788994246215,"『미국 음악가 사전』은 미국에서 출생한 음악인이나 미국으로 이주한 음악인 혹은 일정기간 미국에서 활동인 음악인 375명의 간략한 생애와 작품설명을 담은 책이다. 예술음악 작곡가들과 음악학자들을 대상으로 하였으며, 잘 알려진 재즈 뮤지션과 팝 뮤지션을 포함시켰다. 각 인물들은 알파벳순으로 나열하였으며, 대표작품이나 특이한 작품들을 선별하여 소개하였다. 미국음악을 공부하는 많은 이들이 미국 음악인들의 작품세계를 이해하고 미국 음악의 역사를 연구하는 데 유용한 자료가 될 것이다."
67,오리지널 미국 중,https://search.shopping.naver.com/book/catalog/32492749222,https://shopping-phinf.pstatic.net/main_3249274/32492749222.20220527035540.jpg,박종매,10800,푸른향기,20140329,9788967820091,"미국 로욜라메리마운트대학의 종교학과 교수 종매스님(박종매)이 좌충우돌 해외포교 이야기 『오리지널 미국 중』. 이 책에는 오랜 외국생활과 해외 불제자들과의 인연, 승려로서 경험한 웃지 못할 해프닝, 불사를 하기 위해 직업전선에 뛰어들어야 했던 사연, LA폭동이 일어났을 때 절을 지켜준 흑인 불자들, 서양의 젊은이들과 어울리며 열린 마음으로 불법을 전하는 사연 등 솔직담백한 이야기들이 담겨 있다."
68,미국사회와 문화,https://search.shopping.naver.com/book/catalog/32496107725,https://shopping-phinf.pstatic.net/main_3249610/32496107725.20221230072109.jpg,최영승,16200,동아대학교출판부,20120830,9788944902819,"이 책은 미국사회와 문화에 대해 배우려는 대학생이나 대학원 전문서, 실무자를 위한 책으로 미국사회와 문화의 전반적인 내용을 자세히 설명하고 있다."
69,세계를 간다: 미국 (샌프란시스코 시애틀 시카코 뉴욕 애틀랜타 외),https://search.shopping.naver.com/book/catalog/32496598857,https://shopping-phinf.pstatic.net/main_3249659/32496598857.20220530155234.jpg,세계를간다 편집부,0,알에이치코리아,20130830,9788925551159,"이제 미국 여행이 더욱 재미있어진다!

『세계를 간다: 미국』은 해외여행자들의 경험을 토대로, 현지에서 바로 이용할 수 있는 구체적이고도 실용적인 여행 정보를 총망라한 여행 가이드북이다. 로스앤젤레스, 라스베이거스, 시카고, 뉴욕, 워싱턴 DC 등 미국 전 지역의 주요 도시 정보를 담고 있다. 관광, 교통, 식사, 숙박 등 필수적인 여행 정보를 가득 담은 것은 물론, 해당 지역의 사회, 역사, 문화, 풍속까지 다양한 주제를 다루고 있다. 또 여권 만들기, 출국 수속과 탑승, 통화와 예산, 여행회화 등 여행 준비를 위한 정보도 함께 수록하여 여행자들이 더욱 편안한 여행이 될 수 있도록 도와준다.

▶ 본 도서는 257쪽부터 2도 인쇄로 컬러가 아님을 감안해 주시기 바랍니다."
70,"미국 캠핑 여행기 (퇴직 후, 떠나는)",https://search.shopping.naver.com/book/catalog/32503506732,https://shopping-phinf.pstatic.net/main_3250350/32503506732.20220527024721.jpg,금동화,0,페이퍼북,20131023,9788997148332,"30일, 11,760km를 달려 미국을 횡단한 두 부부의 캠핑 여행기!

『퇴직 후, 떠나는 미국 캠핑 여행기』는 은퇴를 준비하고 있는 두 부부가 답답한 서울 생활에서 잠시 떠나 미국 캠핑 여행길에서 겪은 이야기를 엮은 책이다. 가슴을 뛰게 하는 캠핑장 정보부터 자연을 즐기는 마음가짐까지 알차게 정리해 두었다. 한 여름 설원과 온천수, 다양한 동식물이 공존하는 대자연을 느낄 수 있는 두 부부의 캠핑 여행을 따라가다 보면 삶의 느림과 진정한 행복, 살아간다는 것에 대한 감사함 등을 느낄 수 있을 것이다."
71,미국 법제도 입문,https://search.shopping.naver.com/book/catalog/32503810861,https://shopping-phinf.pstatic.net/main_3250381/32503810861.20220527025319.jpg,토니 파인,0,진원사,20111028,9788963461366,"『미국 법제도 입문』은 미국 법체계가 어떻게 구성되어 있으며 어떻게 작동하는지 간결하고 알기 쉽게 조망한다. 이 책은 특히 미국 법제도의 특징적인 면, 즉 한국과 다른 국가들의 로마법 전통과 구별되는 점들을 소개한다. 여기는 우리의 헌법구조, 미국 소송의 대립구조 및 케이스법과 선례구속의 원칙상 선례의 역할에 대한 설명도 포함되었다."
72,미국건축 이야기,https://search.shopping.naver.com/book/catalog/32504652105,https://shopping-phinf.pstatic.net/main_3250465/32504652105.20220527061426.jpg,이동희,16200,애플트리,20130228,9788998941017,"『이동희 교수의 미국건축 이야기』는 미국 동부지역의 유명한 도시들과 건축물들을 찾아다니며 기록한 감성적 글월들과 예술적 사진들로 구성한 책이다. 총 50편의 건축체험 이야기가 담겨져 있다.필자가 1년 남짓 미국 펜실베이니아대학 방문교수직을 수행하면서, 동부지역의 유명한 도시들과 건축물들을 찾아다니며 기록한 체험적 글월들과 실증적 사진들로 구성했다."
73,미국 50주 사전,https://search.shopping.naver.com/book/catalog/32507726952,https://shopping-phinf.pstatic.net/main_3250772/32507726952.20220521165405.jpg,,16000,메드라인,20070611,9788992190039,
74,전후 미국시 평설,https://search.shopping.naver.com/book/catalog/32539329322,https://shopping-phinf.pstatic.net/main_3253932/32539329322.20220523094441.jpg,,12000,동인(종로),20041008,9788955062045,
75,MARC 21 전거 레코드의 이해,https://search.shopping.naver.com/book/catalog/32735146637,https://shopping-phinf.pstatic.net/main_3273514/32735146637.20221228074813.jpg,미국의회도서관,7200,태일사,20060630,9788989023807,이 책은 미국 의회 도서관에서 발행한 Understanding MARC Authority Records의 온라인 버전 최신 판을 한국어로 완역한 것이다. LC MARC와 USMARC를 거쳐 새로이 태어난 MARC21 전거레코드의 최신 내용을 알기 쉽게 정리하고 있다. 도서관 현장의 실무자들과 학생들에게 많은 도움이 될 것이다....
76,들어라 미국이여 (카스트로 연설모음집),https://search.shopping.naver.com/book/catalog/32839249619,https://shopping-phinf.pstatic.net/main_3283924/32839249619.20221019104516.jpg,피델 카스트로,11700,산지니,20070308,9788992235099,"48년 동안 쿠바를 이끌고 있는 피델 카스트로의 연설 모음집!

『들어라 미국이여』는 피델 카스트로가 세계를 향해 외쳤던 연설과 대담 모음집이다. 48년 동안 쿠바를 이끌어 오고 있으며, 사회주의를 포기하지 않고 있는 노혁명가의 절절한 외침이다. 본문은 2000년 1월에서 2001년 11월에 걸친 카스트로의 연설과 인터뷰 중에서 예리하고 간략한 것들만 선별하였다.

베네수엘라, 파나마, 쿠바, 미국 등에서 행한 연설로서 2000년 유엔에서 개최된 밀레니엄 정상회담, 2001년 남아프리카공화국 더반(Durban)에서 개최된 인종차별주의에 대한 회의에 참가해서 행한 연설 등이 포함되어 있다. 이를 통해 기본적으로 쿠바혁명의 의미를 파악할 수 있다.

또한 이 연설들에는 제3세계에 만연한 에이즈, 빈곤, 죽어가는 아동의 비극, 인종차별, 테러위기 등에 대한 카스트로의 입장이 거침없이 피력되어 있으며, '들어라 미국이여'라는 제목에서 알 수 있듯이 카스트로가 현재의 세계경제정치 질서를 이끌고 있는 미국을 어떻게 비판하고 있는지도 자세히 파악할 수 있다. [양장본]"
77,벼랑 위에 선 미국 (이슬람의 도전과 사라지는 강대국들),https://search.shopping.naver.com/book/catalog/33217587636,https://shopping-phinf.pstatic.net/main_3321758/33217587636.20221019110338.jpg,마크 스타인,14250,인간사랑,20090720,9788974182786,"[표지글]

""마크 스타인은 세계에서 가장 예리하고 위트 있는 이슬람 파시즘 관찰자이다.
이 책은 엄청나게 진지한 만큼 재미가 있고, 진실이 늘 그렇듯이 완고하며,
최신 테러공격의 뉴스만큼이나 시기적절하다.
스타인은 우리의 신세기를 깊이 들여다 보면서 인구학적 힘과 '사회적 스톡홀름 증후군'이
전 세계를 새로운 암흑 시대로 몰아넣는 위협이라고 생각한다.""

휴 휴이트, 공공 라디오 토크쇼 진행자"
78,디즈니경전전영고사: 목우기우기(피노키오)(중영문) 양장,https://search.shopping.naver.com/book/catalog/33378709975,https://shopping-phinf.pstatic.net/main_3337870/33378709975.20220709082828.jpg,미국디즈니공사,0,호북소년아동출판사,20090801,9787535345783,☞이 책은 중국어로 쓰여져 있습니다.
79,비옥환유기(업 UP)(중영문) 양장,https://search.shopping.naver.com/book/catalog/33379003646,https://shopping-phinf.pstatic.net/main_3337900/33379003646.20220709083859.jpg,미국디즈니공사,0,호북소년아동출판사,20090801,9787535348388,☞ 이 책은 중국어로 쓰여져 있습니다.
80,디즈니경전전영고사: 미녀여야수(미녀와야수)(중영문) 양장,https://search.shopping.naver.com/book/catalog/33379149575,https://shopping-phinf.pstatic.net/main_3337914/33379149575.20220709085426.jpg,미국디즈니공사,0,호북소년아동출판사,20090801,9787535345776,☞이 책은 중국어로 쓰여져 있습니다.
81,미국의 지방행정,https://search.shopping.naver.com/book/catalog/33434885855,https://shopping-phinf.pstatic.net/main_3343488/33434885855.20221019132954.jpg,박용래,31500,한국학술정보,20070410,9788953465534,"미국에서 4년간 서울시 주재관으로 근무한 경험을 바탕으로 저술한 책으로, 지방자치관련 제도, 관행에 관하여 서울시 행정과 비교 연구 및 현지 지방정부의 시행자료, 관련 연구기관, 전문 서적 등을 참고로 정리하였다...."
82,미국의 입법과정,https://search.shopping.naver.com/book/catalog/33435240732,https://shopping-phinf.pstatic.net/main_3343524/33435240732.20221230072450.jpg,김영희,10800,한국학술정보,20070830,9788953474130,미국의 입법절차에 대한 연구서. 미국의 법을 성문법 국가에 준하는 시각으로 고찰해보고자 했다. 또한 기초적이고 헌법적인 사항들에서부터 미국 연방의회의 의정규칙이나 선례에 해당하는 세세한 사항까지 전체적인 모습도 살펴본다.
83,미국 비자 포커스 (전종준 변호사의 미국 비자 실제상황 가이드),https://search.shopping.naver.com/book/catalog/33435272624,https://shopping-phinf.pstatic.net/main_3343527/33435272624.20221228073711.jpg,전종준,13500,푸른솔,20070228,9788986804850,"미국 비자 취득을 위한 가이드북

전종준 변호사의 미국 비자 실제상황 가이드 〈미국 비자 포커스〉. 미국 비자 및 이민에 관한 다양한 사례들을 집중적으로 조명한 책이다. 아직도 미국 비자와 이민을 풍문과 비전문인에게 의존하다 보니 신분상 불이익을 당하는 사례가 끊이지 않는 상황에서, 이 책은 변호사의 조력을 구하지 않아도 될 만큼 상세하게 일목요연하게 내용을 제시하고 있다. 

이 책은 한국뿐만 아니라 미국이나 세계 각국에서 미국의 문을 두드리는 모든 사람에게 꼭 필요한 최신 미국 이민법을 비이민 비자, 이민 비자와 시민권으로 나누어 알기 쉽게 정리하였다. 아울러 이민 전문 변호사인 저자가 실제로 다뤄본 다양한 비자 문제를 풍부한 사례 연구를 통해 소개하고 있다. 미국 이민법에 대한 바른 이해와 합법적인 서류 절차로 비자 장벽을 뚫을 수 있도록 도와주는 책이다."
84,미국문화의 이해,https://search.shopping.naver.com/book/catalog/33435303846,https://shopping-phinf.pstatic.net/main_3343530/33435303846.20221230071529.jpg,NEIL CAMPBELL 외,18000,학문사,20020320,9788946781757,"미국문화에 대한 새로운 개론서. 미국이라는 나라의 국가적 정체성을 잡종성과 다원성으로 파악하고, 문화 정치학적 분석 작업을 수행하기 위해 다양한 조망과 접근법을 제시한 책이다."
85,미국역사의 순환,https://search.shopping.naver.com/book/catalog/33845716436,https://shopping-phinf.pstatic.net/main_3384571/33845716436.20221230072425.jpg,아서M.슐레진저 2세,20500,을유문화사,19931105,9788932451435,"미국 역사의 성쇠에 관하여 일반적인 의문을 제기하고, 미국 및 세계에 대한 다양한 주제와 정부의 역할과 전망, 정당과 대통령과 같은 국내 정치를 다루어 한 나라의 정치 조직체로서의 미국을 살펴본 역저이다."
86,미국의 음식문화,https://search.shopping.naver.com/book/catalog/35299450895,https://shopping-phinf.pstatic.net/main_3529945/35299450895.20221018131837.jpg,ELAINE N.MCINTOSH,10800,역민사,19990910,9788985154239,
87,근대 미국 단편선 (한권으로 읽는),https://search.shopping.naver.com/book/catalog/35299551922,https://shopping-phinf.pstatic.net/main_3529955/35299551922.20221018132726.jpg,이선주외 역,11700,동인,20030925,9788955061901,"19세기는 미국의 정체성이 확립된 시기이다. 이 책에서 소개하는 나사니엘 호손과 허먼 멜빌은 이 시기를 대표하는 작가들이며, 마크 트웨인과 헨리 제임스, 윌리엄 딘 하웰즈와 스티븐 크래인 그리고 챨스 워델 체스넛은 남북전쟁을 전후하여 미국 문화와 사회를 대변하는 작가들이다. 또한 케이트 쇼팬, 샬롯 퍼킨스 길먼, 새러 오언 쥬엇은 동시대 남성작가들이 비껴간 사건들과 주제들을 여성의 시각으로 보여주고 있다."
88,위기의 미국 의회 (개혁정치의 허와 실),https://search.shopping.naver.com/book/catalog/35299621434,https://shopping-phinf.pstatic.net/main_3529962/35299621434.20221018134138.jpg,로렌스 에반스 외,11700,오름,20021231,9788977781689,"미국에서 새로이 다수당이 된 공화당이 위기에 놓인 미국의회에 제도개혁을 가하는 정치과정을 심층적으로 다룬 책. 이 책을 통해 1990년대 미국 의회제도 개혁의 구체적 과정, 요인, 내용에 대해 유익한 지식을 얻을 수 있을 뿐만 아니라, 미국 의회정치와 제도개혁정치 일반에 대한 이해와 통찰력을 얻을 수 있다."
89,미국의 산업상담,https://search.shopping.naver.com/book/catalog/35300643834,https://shopping-phinf.pstatic.net/main_3530064/35300643834.20221018142732.jpg,JUDITH A.LEWIS 외,9000,정암서원,20010410,9788986431414,
90,미국 예산정치론,https://search.shopping.naver.com/book/catalog/35300701760,https://shopping-phinf.pstatic.net/main_3530070/35300701760.20221018143357.jpg,이렌 S.루빈,15000,대영문화사,20010410,9788976440914,
91,미국희곡의 이해,https://search.shopping.naver.com/book/catalog/35303438278,https://shopping-phinf.pstatic.net/main_3530343/35303438278.20221019124515.jpg,김용덕,0,동아대학교출판부,20030925,9788944901447,
92,미국의 지방자치,https://search.shopping.naver.com/book/catalog/35304819769,https://shopping-phinf.pstatic.net/main_3530481/35304819769.20221018183855.jpg,김웅기,37000,대영문화사,20010330,9788976440952,"미국의 각급 정부 형태, 조직, 기능 등 각론적이고 실제적인 면에 중점을 둔 미국의 지방자치 안내서. 미국 대륙의 생성과정과 역사를 설명하고 연방정부의 기능과 더불어 행정부에 대해서는 구체적으로 각 부처의 업무 영역까지 소개했다. 또한 주정부의 특징 및 기능과 함께 뉴욕 주정부를 조사 대상으로 선정하여 각 부서의 실제업무도 자세히 기술했다."
93,미국의 대학평가 (고등교육의 질 보장을 위한),https://search.shopping.naver.com/book/catalog/35304867754,https://shopping-phinf.pstatic.net/main_3530486/35304867754.20221018184343.jpg,주삼환,7200,한국학술정보,20060501,9788953448407,"고등교육의 질을 관리하기 위한 방법의 하나가 바로 '대학평가'이다. 대학 스스로가 냉정하고 엄격하게 교육의 질을 관리하지 못하면 교육소비자로부터 불신을 받고 이어서 고발을 당하고, 다시 외부와 정부로부터 강한 통제를 받게 될 것이다. 이 보고서는 정부기관과 평가인정기구에 의한 미국의 전통적인 외적 질 통제의 강점과 약점에 대하여 살펴 보았다. 그 다음에 학교 자체의 자기 규제의 중요성에 대하여 검토해 보고, 마지막으로 자기 규제의 과정을 자세히 다루었다. 이 보고서는 학교의 질을 유지하려 하거나 개선하고자 할 ?.."
94,"미국, 이라는 문제",https://search.shopping.naver.com/book/catalog/35304897412,https://shopping-phinf.pstatic.net/main_3530489/35304897412.20221018190036.jpg,박의상,5400,아침나라,20020930,9788955870350,
95,미국영어음성학,https://search.shopping.naver.com/book/catalog/35305738200,https://shopping-phinf.pstatic.net/main_3530573/35305738200.20221018192759.jpg,원성옥 외,10000,경남대학교출판부,20001120,9788984210493,
96,미국 장로교회사,https://search.shopping.naver.com/book/catalog/35306019452,https://shopping-phinf.pstatic.net/main_3530601/35306019452.20221018194352.jpg,존 피츠미어,9900,기독교문서선교회,20040830,9788934108344,"미국 장로교를 역사적으로 서술하면서 장로교의 기원인 개신교 종교개혁에서 출발하여, 스코틀랜드 및 신대륙 식민지에서의 발전 그리고 20세기 에큐메니칼 운동을 망라하는 역사를 다루고, 부분에서는 미국 장로교 역사의 주요 인물에 대해 개관한다...."
